,,"B08ZJQCZJ4",,,,,,,,,,,,,,,,,,,,,,,,,,,,,,,,,,,,,,,,,,,,,,,,,,,,,,,,,,,,,,,,,,,,,,,,,,,,"MOIPEJO","Tools & Home Improvement › Safety & Security › Flashlights › Hands Free Flashlights & Headlamps › Hands Free Flashlights","https://www.amazon.com/s?k=tools&crid=RA8JEXW4BXDE&sprefix=tool%2Caps%2C318&ref=nb_sb_noss_1&language=en&fs=true","22","Thursday, December 28",,"Thursday, December 28","Fabric","Imported","Unique Gifts for Men & Women: Light is needed everywhere in life. He/She will definitely need flashlight gloves cool tools that free up their hands. Our LED flashlight gloves will surely be an amazing mens gift. Useful gift for Dad, Mom, husband, boyfriend, DIYer, handyman on Father's Day, Mother's Day, Birthdays, Christmas.","Waterproof & Cool Gadgets for Men - These flashlight gloves will be a third helping hand, suitable for fishing, hiking, mountain camping, cycling, running and other outdoor night activities.","One Size Fits Most - The adjustable strap can be stretched to fit even big hands and unisex design that will suit both men and women.","Comfortable Material -Our LED gloves are made of breathable and soft fabric, which is lightweight and skin-friendly for any working season and fits your hands perfectly.","Package Included - 1 pair* Flashlights Gloves(batteries installed), 1* Screwdriver, extra offer 4*CR2016 button battery.",,,,"https://m.media-amazon.com/images/I/41M7zjkWVkL._AC_US.jpg","https://m.media-amazon.com/images/I/51FLaQoCDsS._AC_US.jpg","https://m.media-amazon.com/images/I/51+zyMZZQAL._AC_US.jpg","https://m.media-amazon.com/images/I/41LycSt-B9L._AC_US.jpg","https://m.media-amazon.com/images/I/51rd2-3ZBJL._AC_US.jpg","https://m.media-amazon.com/images/I/41Pih+HsNKL._AC_US.jpg","https://m.media-amazon.com/images/I/91Fei17zA9L.SS125_PKplay-button-mb-image-grid-small_.jpg","true","https://m.media-amazon.com/images/I/61GS1Bos9xL._AC_SL1500_.jpg","https://m.media-amazon.com/images/I/819gXX0l8VS._AC_SL1500_.jpg","https://m.media-amazon.com/images/I/71fouNLScOL._AC_SL1500_.jpg","https://m.media-amazon.com/images/I/61XzPl86FxL._AC_SL1500_.jpg","https://m.media-amazon.com/images/I/71F3Eje5GlL._AC_SL1500_.jpg","https://m.media-amazon.com/images/I/71w8coyTllL._AC_SL1500_.jpg","https://m.media-amazon.com/images/I/71FcI-K0m5L._AC_SL1500_.jpg","https://m.media-amazon.com/images/I/61rSTmFmf8L._AC_SL1500_.jpg",,,,,,"true","In Stock  In Stock","false",,,,"US","Update location",,,,,,,,,,,,,,,,,,,,"$","18.99","Special Feature","Lightweight, Adjustable Strap, Adjustable","Color","Black","Power Source","Battery Powered","Light Source Type","LED","Material","Carbon Fiber",,,,,,,,,,,,"5709","/Flashlight-Christmas-Boyfriend-Repairing-Valentines/product-reviews/B08ZJQCZJ4?reviewerType=all_reviews","Save 5% with coupon",,,,,,,,,"A16GS820KXMCJW","MOIPEJO",,,"/gp/help/seller/at-a-glance.html/ref=dp_merchant_link?ie=UTF8&seller=A16GS820KXMCJW&asin=B08ZJQCZJ4&ref_=dp_merchant_link&isAmazonFulfilled=1",,,,"4.4","0.04","0.03","0.08","0.15","0.7",,"https://m.media-amazon.com/images/I/61GS1Bos9xL.__AC_SX300_SY300_QL70_ML2_.jpg","MOIPEJO LED Flashlight Gloves, Stocking Stuffers for Adults Christmas Gifts for Men Dad Boyfriend Husband Him, Cool Gadget Tools for Camping Fishing, Fathers Day Valentines Birthday Gift","https://www.amazon.com/s?k=tools&crid=RA8JEXW4BXDE&sprefix=tool%2Caps%2C318&ref=nb_sb_noss_1&language=en&fs=true&page=1","https://www.amazon.com/dp/B08ZJQCZJ4",,,,,,,,,,,,,,,,,,,,,,,,,,,,,,,,,,,,,,,,,,,,,,,,,,,,,,,,,,,,,,,,,,,,,,,,,,,,,,,,,,,,,,,,,,,,,,,,,,,,,,,,,,,,,,,,,,,,,,,,,,,,,,,,,,,,,,,,,,,,,,,,,,,,,,,,,,,,,,,,,,,,,,,,,,,,,,,,,,,,,,,,,,,,,,,,,,,,,,,,
"in Magnetic Sweepers by VIBELITE",,"B08BHLV4QL","Special Feature","","Power Source","","Light Source Type","","Material","","Included Components","","Battery Cell Composition","","Number of Batteries","","Brand","","Style","","Manufacturer","","Part Number","","Item Weight","","Package Dimensions","","Item model number","","Batteries","","Special Features","","Batteries Included?","","Batteries Required?","","ASIN","B08BHLV4QL","Date First Available","June 18, 2020",,,,,,,,,,,,,,,,,,,,,,,"Tools & Home Improvement","228","https://www.amazon.com/gp/bestsellers/hi/ref=pd_zg_ts_hi","Magnetic Sweepers","14","https://www.amazon.com/gp/bestsellers/hi/553242/ref=pd_zg_hrsr_hi",,,,,,,,"VIBELITE","Tools & Home Improvement › Power & Hand Tools › Hand Tools › Magnetic Sweepers","https://www.amazon.com/s?k=tools&crid=RA8JEXW4BXDE&sprefix=tool%2Caps%2C318&ref=nb_sb_noss_1&language=en&fs=true","19","Wednesday, December 27",,"Saturday, December 23","🎁【Stocking Stuffers for Men】VIBELITE pickup magnet tool with personalised gifts box are unique cool gadgets gifts for men, women, handyman, husbands, boyfriends, grandpa gifts on Christmas, Father's Day, birthday, thanksgiving day or anniversary. Everyone who receives this gift will love him.","🎁【Telescoping Magnetic Pickup Tool】 3 super bright LED bulbs, 360 degree illumination provides light where most flashlights can not go.Extendable stem, flexible neck,Magnet head and base, Magnetic ends pick up washers,screws,nuts or bolts when you need a third hand.","🎁【Perfect tools for men】 Built with military grade aluminum alloy, making them weather proof and shockproof. Versatile and perfect for camping, boating, fishing, home improvement and roadside emergencies.","🎁【Package includes】 The packaging of this magnetic flashlight includes 4×LR44 Batteries and Flexible magnetic flashlight. Length: 7 inch. Extendable to 22 Inches.","🎁【12 MONTHS PROMISE】 Backed by the VIBELITE customer satisfaction . We will always replace a faulty product or refund your purchase. Just contact us if you have any problems.",,,,,,"https://m.media-amazon.com/images/I/51pxSGniq3L._AC_US.jpg","https://m.media-amazon.com/images/I/41Ro4bcFtvL._AC_US.jpg","https://m.media-amazon.com/images/I/51yGNDN7-tL._AC_US.jpg","https://m.media-amazon.com/images/I/51mUClLoqnL._AC_US.jpg","https://m.media-amazon.com/images/I/41W+GrBHY2L._AC_US.jpg","https://m.media-amazon.com/images/I/51pNaU9892L._AC_US.jpg","https://m.media-amazon.com/images/I/41GP-q++b2L._AC_US.jpg","true","https://m.media-amazon.com/images/I/814Y0TxR70L._AC_SL1500_.jpg","https://m.media-amazon.com/images/I/61gjp6WbopL._AC_SL1500_.jpg","https://m.media-amazon.com/images/I/81OGVwPi89L._AC_SL1500_.jpg","https://m.media-amazon.com/images/I/71pHmuHxt2L._AC_SL1500_.jpg","https://m.media-amazon.com/images/I/71rt0BOn1SL._AC_SL1500_.jpg","https://m.media-amazon.com/images/I/71z1-1bjYaL._AC_SL1500_.jpg","https://m.media-amazon.com/images/I/61hSSHngorL._AC_SL1500_.jpg","https://m.media-amazon.com/images/I/71ARp8T6tXS._AC_SL1000_.jpg","https://m.media-amazon.com/images/I/61XljvhbtYL._AC_SL1500_.jpg",,,,,"true","In Stock  In Stock","true",,,,"US","Update location",,,,,,,,,,,,,,,,,,,,"$","21.99","Special Feature","Flexible, Extensible","Power Source","Battery Powered","Light Source Type","LED","Material","Iron","Included Components","Battery",,,,,,,,,,,,"1459","/Magnetic-Christmas-Boyfriend-Batteries-batteries/product-reviews/B08BHLV4QL/ref=cm_cr_dp_d_show_all_btm?ie=UTF8&reviewerType=all_reviews","Save 10% with coupon",,,,,,,,,"AQ8OX0LXJQYTU","VIBELITE",,,"/gp/help/seller/at-a-glance.html/ref=dp_merchant_link?ie=UTF8&seller=AQ8OX0LXJQYTU&asin=B08BHLV4QL&ref_=dp_merchant_link&isAmazonFulfilled=1",,,,"4.6","0.03","0.02","0.07","0.13","0.75",,"https://m.media-amazon.com/images/I/814Y0TxR70L.__AC_SX300_SY300_QL70_FMwebp_.jpg","VIBELITE Magnetic Pickup Tool with LED, Telescoping Magnet Flashlight, Stocking Stuffers for Men Christmas Gifts for Men, Him, Husband, Father, Grandpa (Black)","https://www.amazon.com/s?k=tools&crid=RA8JEXW4BXDE&sprefix=tool%2Caps%2C318&ref=nb_sb_noss_1&language=en&fs=true&page=1","https://www.amazon.com/dp/B08BHLV4QL","B08BHLV4QL","B08M97SBYG",,,,,,,,"Style","Black Magnetic Tool",,,"B08M97SBYG","https://m.media-amazon.com/images/I/819rdms3ccL._AC_SL1500_.jpg","https://m.media-amazon.com/images/I/71mKViqlr4L._AC_SL1500_.jpg","https://m.media-amazon.com/images/I/71luf-xTwCL._AC_SL1500_.jpg","https://m.media-amazon.com/images/I/71nB-X0Sy-L._AC_SL1500_.jpg","https://m.media-amazon.com/images/I/81xG9QpyIgL._AC_SL1500_.jpg","https://m.media-amazon.com/images/I/71V2aDTDjTL._AC_SL1500_.jpg","https://m.media-amazon.com/images/I/71HAtVNO78L._AC_SL1500_.jpg","https://m.media-amazon.com/images/I/71QT8cPAQoL._AC_SL1500_.jpg",,,,,,"Magnetic Tool + Stylus Pen",,,,"https://m.media-amazon.com/images/I/519-a0Q6mfL._AC_US.jpg","B08BHLV4QL","https://m.media-amazon.com/images/I/814Y0TxR70L._AC_SL1500_.jpg","https://m.media-amazon.com/images/I/61gjp6WbopL._AC_SL1500_.jpg","https://m.media-amazon.com/images/I/81OGVwPi89L._AC_SL1500_.jpg","https://m.media-amazon.com/images/I/71pHmuHxt2L._AC_SL1500_.jpg","https://m.media-amazon.com/images/I/71rt0BOn1SL._AC_SL1500_.jpg","https://m.media-amazon.com/images/I/71z1-1bjYaL._AC_SL1500_.jpg","https://m.media-amazon.com/images/I/61hSSHngorL._AC_SL1500_.jpg","https://m.media-amazon.com/images/I/71ARp8T6tXS._AC_SL1000_.jpg","https://m.media-amazon.com/images/I/61XljvhbtYL._AC_SL1500_.jpg",,,"Black Magnetic Tool",,,,"https://m.media-amazon.com/images/I/51pxSGniq3L._AC_US.jpg",,,,,,,,,,,,,,,,,,,,,,,,,,,,,,,,,,,,,,,,,,,,,,,,,,,,,,,,,,,,,,,,,,,,,,,,,,,,,,,,,,,,,,,,,,,,,,,,,,,,,,,,,,,,,,,,,,,,,,,,,,,,,,,,,,,,,,,,,,,,,,,,,,,,,,,
,,"B08TM2F4BH","Material","","Brand","","Style","","Item Dimensions LxWxH","","Compatible Material","","Item Form","","Color","","Manufacturer","","Part Number","","Item Weight","","Product Dimensions","","Item model number","","Power Source","","Included Components","","Batteries Included?","","Batteries Required?","","ASIN","B08TM2F4BH","Date First Available","January 21, 2021",,,,,,,,,,,,,,,,,,,,,,,,,,,"Tools & Home Improvement","914","https://www.amazon.com/gp/bestsellers/hi/ref=pd_zg_ts_hi","Hand Caulking Guns","3","https://www.amazon.com/gp/bestsellers/hi/553140/ref=pd_zg_hrsr_hi",,,,,,,,"Saker","Tools & Home Improvement › Power & Hand Tools › Hand Tools › Caulking Guns","https://www.amazon.com/s?k=tools&crid=RA8JEXW4BXDE&sprefix=tool%2Caps%2C318&ref=nb_sb_noss_1&language=en&fs=true","27",,,,"【Professional Design】 - Saker silicone caulking tools could combine 3 functions into 1,including internal angle scraper,flat angle scraper,silicone smoother,It can help you remove the seal and re-sealing and repair the gap and clean the residual glue easily.","【Durable Material】- Saker 3 in 1 caulking tool has sharp hard stainless steel blade for long-lasting strength removing;Nice silicone trowel for the removal of bumps and dents surface;White silicone pads for smooth application of new silicone!","【Effectiveness】-Saker 3 in 1 sealant finishing tool grout remove scraper with versatile tools with many uses,easy to rip the old caulk and smooth the caulk well.No need for masking tape,it is convenient and quick to use and save time.","【Multiple Usage Scenarios】- Saker caulk remover glass glue angle scraper is a perfect tool kit;Great ideal for home,kitchen,bathroom,floor,tank,window,sink joint,frames seal and so on.The smart dimension is applicable for interior and exterior caulking.","【Perfect Choice】- Saker silicone caulk remover is a great product for removing and spreading caulk,improving the agglutinating quality and the aesthetic sense of surface.",,,,,,"https://m.media-amazon.com/images/I/41j3iOmWXYL._AC_US.jpg","https://m.media-amazon.com/images/I/41cp4lUbbdL._AC_US.jpg","https://m.media-amazon.com/images/I/515pasKVwYL._AC_US.jpg","https://m.media-amazon.com/images/I/41DeBR271GL._AC_US.jpg","https://m.media-amazon.com/images/I/51w+rK7RtjL._AC_US.jpg","https://m.media-amazon.com/images/I/51Oj7rz0mQL._AC_US.jpg","https://m.media-amazon.com/images/I/A1YzUxFgM9L.SS125_PKplay-button-mb-image-grid-small_.jpg","true","https://m.media-amazon.com/images/I/61ipcKHF3ZL._AC_SL1500_.jpg","https://m.media-amazon.com/images/I/713ypvX6HbL._AC_SL1500_.jpg","https://m.media-amazon.com/images/I/81Svb4W4IEL._AC_SL1500_.jpg","https://m.media-amazon.com/images/I/61qjoTKHdtL._AC_SL1500_.jpg","https://m.media-amazon.com/images/I/81Zk1zMZGmL._AC_SL1500_.jpg","https://m.media-amazon.com/images/I/71UPDXgx-oL._AC_SL1500_.jpg",,,,,,,,"false","Currently unavailable.      Currently unavailable.","false",,,,"BD","Bangladesh","3 in 1 sealant finishing tool","This is a multipurpose tool that easily remove old glue and smooths out caulk very well.It is an essential caulking tool in our life.","Sharp Hard Stainless Steel","Double edge scraper for inner and outer corners and the two sides are fixed by four screws,it is not easy for the scraper head to loosen,you can feel handy when using this tool.","Silicone Cauik Remover","After removing the old glue,you could fill the seams with seam glue.Five kinds of silicone heads with different radians can meet your different scene needs.Also this caulking tool could smooth the caulk well.","Easy to Remove Glue","This new caulking tool kit adopt new materials and new design,wear-resistant and durable.Double edge scraper design make the cleaning more efficient.","Versatile Caulking Tool","This 3 in 1 caulking tool is convenient and quick to use and saves time.Beginners can get started quickly.","Multiple Usage Scenarios","Saker silicone caulking tools could fit for doing any type of caulk work.Such as home, kitchen, bathroom, window, sink joint etc.","Wall,Floor Tiles","Saker grout remove scraper can be applied to walls, floors and tiles and various seam connections,etc","Toilet,Bathroom","Saker 3 in 1 sealant finishing tool can also be used in kitchen ,bathroom, toilet,etc","Washbasin,Sink Joints","Saker caulk remover glass glue angle scraper can also be used for bathtub,ashbasins, sink joints, etc.",,,,"Material","Silicone","Brand","Saker","Style","Tools & Home Improvement","Item Dimensions LxWxH","7.44 x 2.05 x 1.54 inches","Compatible Material","Stainless Steel, Plastic",,,,,,,,,,,,"6711","/Saker-Silicone-Finishing-Stainless-Steelhead/product-reviews/B08TM2F4BH/ref=cm_cr_dp_d_show_all_btm?ie=UTF8&reviewerType=all_reviews","Save 5% with coupon",,,,,,,,,,,,,,,,,"4.1","0.07","0.05","0.12","0.2","0.56",,"https://m.media-amazon.com/images/I/61ipcKHF3ZL.__AC_SX300_SY300_QL70_FMwebp_.jpg","Saker Silicone Caulking Tools-3 in 1 Sealant Finishing Tool Grout Remove Scraper (Stainless Steelhead) for Bathroom,Kitchen,Floor,Window,Sink Joint,Frames Seal","https://www.amazon.com/s?k=tools&crid=RA8JEXW4BXDE&sprefix=tool%2Caps%2C318&ref=nb_sb_noss_1&language=en&fs=true&page=1","https://www.amazon.com/dp/B08TM2F4BH","B08TM2F4BH","B09YRG4CHN","B0BS6N7FSS",,,,,,,"Color","Black",,,"B0BS6N7FSS","https://m.media-amazon.com/images/I/71zjFXgQtZL._AC_SL1500_.jpg","https://m.media-amazon.com/images/I/71IjNcP4C-L._AC_SL1500_.jpg","https://m.media-amazon.com/images/I/71bNlHuHRbL._AC_SL1500_.jpg","https://m.media-amazon.com/images/I/719IVGiUuLL._AC_SL1500_.jpg","https://m.media-amazon.com/images/I/81xcIxH1n+L._AC_SL1500_.jpg","https://m.media-amazon.com/images/I/71S3bmj329L._AC_SL1500_.jpg",,,,,,,,"Silver",,,,"https://m.media-amazon.com/images/I/51CBaApzJPL._AC_US.jpg","B08TM2F4BH","https://m.media-amazon.com/images/I/61ipcKHF3ZL._AC_SL1500_.jpg","https://m.media-amazon.com/images/I/713ypvX6HbL._AC_SL1500_.jpg","https://m.media-amazon.com/images/I/81Svb4W4IEL._AC_SL1500_.jpg","https://m.media-amazon.com/images/I/61qjoTKHdtL._AC_SL1500_.jpg","https://m.media-amazon.com/images/I/81Zk1zMZGmL._AC_SL1500_.jpg","https://m.media-amazon.com/images/I/71UPDXgx-oL._AC_SL1500_.jpg",,,,,,"Black",,,,"https://m.media-amazon.com/images/I/41j3iOmWXYL._AC_US.jpg","B09YRG4CHN","https://m.media-amazon.com/images/I/71EwI1yWgRL._AC_SL1500_.jpg","https://m.media-amazon.com/images/I/71--e9KmJtL._AC_SL1500_.jpg","https://m.media-amazon.com/images/I/61LQc9N+w8L._AC_SL1500_.jpg",,,,,,,,,,,,,,,,,,"Black-1",,,,"https://m.media-amazon.com/images/I/41S28sceU+L._AC_US.jpg",,,,,,,,,,,,,,,,,,,,,,,,,,,,,,,,,,,,,,,,,,,,,,,,,,,,,,,,,,,,,,,,,,,,,,,,,,,,,,,,,,,,,,,,,,,,,,,,,,,,,,,,,,,,,,,,,,,,,,,,,,,,,
,,"B01CR7IMFS","Product Dimensions","17""D x 38""W x 19.5""H","Brand","Sunnydaze","Material","Alloy Steel","Color","Green","Special Feature","Adjustable Handle","Number of Shelves","2","Recommended Uses For Product","Outdoor","Target Audience","Adults","Handle Material","Alloy Steel","Tire Type","Cart Tire","Item Weight","32 Pounds","Number of Wheels","4","Weight Limit","300 Pounds","Assembly Required","Yes","Caster Type","Pneumatic","Frame Material","Alloy Steel","Item Weight","32 pounds","Manufacturer","Sunnydaze Decor","ASIN","B01CR7IMFS","Country of Origin","China","Item model number","QH-RCP028-GN","Is Discontinued By Manufacturer","No","Maximum recommended load","300 Pounds","Finish types","Steel","Care instructions","Hand Washable","Number of pieces","1","Warranty Description","1-year manufacturer's warranty.","Batteries required","No","Included Components","Garden Cart","Import","Imported",,,"Patio, Lawn & Garden","27919","https://www.amazon.com/gp/bestsellers/lawn-garden/ref=pd_zg_ts_lawn-garden","Garden Carts","123","https://www.amazon.com/gp/bestsellers/lawn-garden/553936/ref=pd_zg_hrsr_lawn-garden",,,,,,,,"Sunnydaze","Patio, Lawn & Garden › Gardening & Lawn Care › Outdoor Carts › Garden Carts","https://www.amazon.com/s?k=tools&crid=RA8JEXW4BXDE&sprefix=tool%2Caps%2C318&ref=nb_sb_noss_1&language=en&fs=true","21","Tuesday, December 26",,,"Overall dimensions: This garden cart measures 38"" W x 17"" D x 19.5"" H (not including the handle). The extendable handle can be adjusted between 19.5"" to 30"" long. The seat measures 17.75"" W x 15"" D. It weighs 32 lbs and has a weight capacity of 300 lbs. The seat adjusts from 16.5"" to 22"" H so you can easily find a comfortable height for working.","Durable design: This heavy-duty yard cart frame is made from powder-coated steel with an extendable handle. It features a removable light round planter basket and coated tire rims. It also has a plastic utility tray beneath the seat.","Fantastic features: The seat on the tractor scooter features a 360 degree swivel motion so you can completely rotate as you work. Steel axles and pneumatic wheels ensure that you can count on the utility cart to last through many years of landscaping and outdoor projects. Plus, the extendable steering handle allows you to pull the lawn cart with ease.","Work smarter, not harder: This steel cart is easier on your lower back and the basket gives you a great place for your tools. It can also be used in the shop, on the ranch, or at the farm.","Worry-free purchasing: Sunnydaze Decor backs its products with a 1-year manufacturer's warranty.",,,,,,"https://m.media-amazon.com/images/W/MEDIAX_792452-T1/images/I/41wDFq-X83L._AC_US.jpg","https://m.media-amazon.com/images/W/MEDIAX_792452-T1/images/I/61Mi04POaML._AC_US.jpg","https://m.media-amazon.com/images/W/MEDIAX_792452-T1/images/I/51WOFboNtSL._AC_US.jpg","https://m.media-amazon.com/images/W/MEDIAX_792452-T1/images/I/51W1hxn+-tL._AC_US.jpg","https://m.media-amazon.com/images/W/MEDIAX_792452-T1/images/I/51oZupmSJxL._AC_US.jpg","https://m.media-amazon.com/images/W/MEDIAX_792452-T1/images/I/513vA+ByY7L._AC_US.jpg","https://m.media-amazon.com/images/W/MEDIAX_792452-T1/images/I/51+oGsgc6HL.SS125_PKplay-button-mb-image-grid-small_.jpg","true","https://m.media-amazon.com/images/W/MEDIAX_792452-T1/images/I/71cSNarXX6L._AC_SL1500_.jpg","https://m.media-amazon.com/images/W/MEDIAX_792452-T1/images/I/91C5njdJqNL._AC_SL1500_.jpg","https://m.media-amazon.com/images/W/MEDIAX_792452-T1/images/I/81Mb8FtrRgL._AC_SL1500_.jpg","https://m.media-amazon.com/images/W/MEDIAX_792452-T1/images/I/91cQ8z93GOL._AC_SL1500_.jpg","https://m.media-amazon.com/images/W/MEDIAX_792452-T1/images/I/81VYc287pkL._AC_SL1500_.jpg","https://m.media-amazon.com/images/W/MEDIAX_792452-T1/images/I/81btawlLyDL._AC_SL1500_.jpg","https://m.media-amazon.com/images/W/MEDIAX_792452-T1/images/I/817a4HMthYL._AC_SL1500_.jpg","https://m.media-amazon.com/images/W/MEDIAX_792452-T1/images/I/81mv1drvSVL._AC_SL1500_.jpg","https://m.media-amazon.com/images/W/MEDIAX_792452-T1/images/I/81r1pzhhVrL._AC_SL1500_.jpg","https://m.media-amazon.com/images/W/MEDIAX_792452-T1/images/I/61ppt9XYFuL._AC_SL1000_.jpg",,,,"true","In Stock","false",,,,"US","Update location",,,,,,,,,,,,,,,,,,,,"$","159","Product Dimensions","17""D x 38""W x 19.5""H","Brand","Sunnydaze","Material","Alloy Steel","Color","Green","Special Feature","Adjustable Handle",,,,,,,,,,,,"739","/Sunnydaze-Rolling-Scooter-Extendable-Utility/product-reviews/B01CR7IMFS/ref=cm_cr_dp_d_show_all_btm?ie=UTF8&reviewerType=all_reviews",,,,,,,,,,"A3VCRITOBCN68L","Sunnydaze Decor",,,"/gp/help/seller/at-a-glance.html/ref=dp_merchant_link?ie=UTF8&seller=A3VCRITOBCN68L&asin=B01CR7IMFS&ref_=dp_merchant_link",,,,"4.4","0.04","0.03","0.07","0.19","0.68",,"https://m.media-amazon.com/images/W/MEDIAX_792452-T1/images/I/71cSNarXX6L.__AC_SX300_SY300_QL70_FMwebp_.jpg","Sunnydaze Garden Cart Rolling Scooter - Features Extendable Steer Handle, Swivel Seat and Utility Tool Tray - Green","https://www.amazon.com/s?k=tools&crid=RA8JEXW4BXDE&sprefix=tool%2Caps%2C318&ref=nb_sb_noss_1&language=en&fs=true&page=1","https://www.amazon.com/dp/B01CR7IMFS","B01CR7IRIU","B01CR7IMFS","B01CR7ITJ2",,,,,,,"Color","Green",,,"B01CR7ITJ2","https://m.media-amazon.com/images/W/MEDIAX_792452-T1/images/I/71OxJ6nHJoL._AC_SL1500_.jpg","https://m.media-amazon.com/images/W/MEDIAX_792452-T1/images/I/91KsAeryaeL._AC_SL1500_.jpg","https://m.media-amazon.com/images/W/MEDIAX_792452-T1/images/I/91274UDM-WL._AC_SL1500_.jpg","https://m.media-amazon.com/images/W/MEDIAX_792452-T1/images/I/81VTskvJkGL._AC_SL1500_.jpg","https://m.media-amazon.com/images/W/MEDIAX_792452-T1/images/I/81pD9TJQ+TL._AC_SL1500_.jpg","https://m.media-amazon.com/images/W/MEDIAX_792452-T1/images/I/81Z-SigzdXL._AC_SL1500_.jpg","https://m.media-amazon.com/images/W/MEDIAX_792452-T1/images/I/81lRyTfy-7L._AC_SL1500_.jpg","https://m.media-amazon.com/images/W/MEDIAX_792452-T1/images/I/81xRF3ImaKL._AC_SL1500_.jpg","https://m.media-amazon.com/images/W/MEDIAX_792452-T1/images/I/61MzDiOB-KL._AC_SL1000_.jpg",,,,,"Red",,"$","159","https://m.media-amazon.com/images/W/MEDIAX_792452-T1/images/I/41o7bK7KX+L._AC_US.jpg","B01CR7IRIU","https://m.media-amazon.com/images/W/MEDIAX_792452-T1/images/I/716Tx74HxPL._AC_SL1500_.jpg","https://m.media-amazon.com/images/W/MEDIAX_792452-T1/images/I/91geK-7GEVL._AC_SL1500_.jpg","https://m.media-amazon.com/images/W/MEDIAX_792452-T1/images/I/91IlM1E5LHL._AC_SL1500_.jpg","https://m.media-amazon.com/images/W/MEDIAX_792452-T1/images/I/81EJ2SaOkbL._AC_SL1500_.jpg","https://m.media-amazon.com/images/W/MEDIAX_792452-T1/images/I/916xScFSZvL._AC_SL1500_.jpg","https://m.media-amazon.com/images/W/MEDIAX_792452-T1/images/I/81EXP7-LQbL._AC_SL1500_.jpg","https://m.media-amazon.com/images/W/MEDIAX_792452-T1/images/I/81jo5ltGS1L._AC_SL1500_.jpg","https://m.media-amazon.com/images/W/MEDIAX_792452-T1/images/I/81fg89k+RPL._AC_SL1500_.jpg","https://m.media-amazon.com/images/W/MEDIAX_792452-T1/images/I/61zuvPM+QlL._AC_SL1000_.jpg",,,"Blue",,"$","159","https://m.media-amazon.com/images/W/MEDIAX_792452-T1/images/I/41lpzprLhqL._AC_US.jpg","B01CR7IMFS","https://m.media-amazon.com/images/W/MEDIAX_792452-T1/images/I/71cSNarXX6L._AC_SL1500_.jpg","https://m.media-amazon.com/images/W/MEDIAX_792452-T1/images/I/91C5njdJqNL._AC_SL1500_.jpg","https://m.media-amazon.com/images/W/MEDIAX_792452-T1/images/I/81Mb8FtrRgL._AC_SL1500_.jpg","https://m.media-amazon.com/images/W/MEDIAX_792452-T1/images/I/91cQ8z93GOL._AC_SL1500_.jpg","https://m.media-amazon.com/images/W/MEDIAX_792452-T1/images/I/81VYc287pkL._AC_SL1500_.jpg","https://m.media-amazon.com/images/W/MEDIAX_792452-T1/images/I/81btawlLyDL._AC_SL1500_.jpg","https://m.media-amazon.com/images/W/MEDIAX_792452-T1/images/I/817a4HMthYL._AC_SL1500_.jpg","https://m.media-amazon.com/images/W/MEDIAX_792452-T1/images/I/81mv1drvSVL._AC_SL1500_.jpg","https://m.media-amazon.com/images/W/MEDIAX_792452-T1/images/I/81r1pzhhVrL._AC_SL1500_.jpg","https://m.media-amazon.com/images/W/MEDIAX_792452-T1/images/I/61ppt9XYFuL._AC_SL1000_.jpg",,,,,,,,,,,"Green",,"$","159","https://m.media-amazon.com/images/W/MEDIAX_792452-T1/images/I/41wDFq-X83L._AC_US.jpg",,,,,,,,,,,,,,,,,,,,,,,,,,,,,,,,,,,,,,,,,,,,,,,,,,,,,,,,,,,,,,,,,,,,,,,,,,,,,,,,,,,,,,,,,,,,,,,,,,,,,,,,,,,,,,,,,,,,,,,,,,,,,
