,,"B08185FNDZ","Manufacturer","","Part Number","","Item Weight","","Product Dimensions","","Item model number","","Batteries","","Size","","Color","","Material","","Power Source","","Voltage","","Item Package Quantity","","Speed","","Included Components","","Batteries Included?","","Batteries Required?","","Battery Cell Type","","ASIN","B08185FNDZ","Date First Available","November 9, 2019",,,,,,,,,,,,,,,,,,,,,,,,,"Tools & Home Improvement","17278","https://www.amazon.com/gp/bestsellers/hi/ref=pd_zg_ts_hi","Power Drill Drivers","65","https://www.amazon.com/gp/bestsellers/hi/9022404011/ref=pd_zg_hrsr_hi",,,,,,,,"DD dedeo","Tools & Home Improvement › Power & Hand Tools › Power Tools › Drills › Drill Drivers","https://www.amazon.com/s?k=tools&crid=RA8JEXW4BXDE&sprefix=tool%2Caps%2C318&ref=nb_sb_noss_1&language=en&fs=true","58","Sunday, December 31",,"Saturday, December 23","🧰【Cordless Drill Set】- Large 3/8""(10mm) keyless chuck can provide you superior bit retention，Equipped with 3-in-1 working mode, screw driving, drilling and impact drilling, this variable-speed (0-350RPM, 0-1350RPM) and 18+1 position drill is a powerful all-round helper for matching your desires, perfect for professional and DIYers.","🧰【 High Performance】-This 16.8V cordless drill with 1500mAh large capacity Li-ion battery, you never need to worry about running out of power in the middle of a project. The battery is simple to change and charge.","🧰【Ergonomic Handle】-The anti-slip grip ergonomic handle is made of soft rubber, which fits nicely in your hand. Comes with a trigger-delay LED work light which stays on for ten seconds after you’ve let go of the trigger, useful in dark basements or underneath a vehicle.","🧰【Highly Durable and Safe to Use】-All of the tools meet specifications for added safety. No need to worry about your tools getting damaged or breaking while in use. Notice: please make sure the drill driver is fully charged at the first time using.","🧰【Quality Guarantee】-This portable tool set is easy to carry allowing you to take your tools with you to work, around the house or outdoors.Our tool set are forged for strength, lasts a lifetime in normal use. If you are not satisfied, we offer a FREE replacement or full refund.",,,,,,"https://m.media-amazon.com/images/W/MEDIAX_792452-T2/images/I/513wzLstniL._AC_US.jpg","https://m.media-amazon.com/images/W/MEDIAX_792452-T2/images/I/51C7b78JHBS._AC_US.jpg","https://m.media-amazon.com/images/W/MEDIAX_792452-T2/images/I/51nFGlDqwOL._AC_US.jpg","https://m.media-amazon.com/images/W/MEDIAX_792452-T2/images/I/511AUMdQ1bS._AC_US.jpg","https://m.media-amazon.com/images/W/MEDIAX_792452-T2/images/I/51ABJuvPS0S._AC_US.jpg","https://m.media-amazon.com/images/W/MEDIAX_792452-T2/images/I/51kc0SoWm3S._AC_US.jpg","https://m.media-amazon.com/images/W/MEDIAX_792452-T2/images/I/51dNTQWGZvL.SS125_PKplay-button-mb-image-grid-small_.jpg","true","https://m.media-amazon.com/images/W/MEDIAX_792452-T2/images/I/71zM91ivsbL._AC_SL1500_.jpg","https://m.media-amazon.com/images/W/MEDIAX_792452-T2/images/I/81NIbw0bNpS._AC_SL1500_.jpg","https://m.media-amazon.com/images/W/MEDIAX_792452-T2/images/I/71CDdxl+zAL._AC_SL1500_.jpg","https://m.media-amazon.com/images/W/MEDIAX_792452-T2/images/I/812XruENmVS._AC_SL1500_.jpg","https://m.media-amazon.com/images/W/MEDIAX_792452-T2/images/I/71gyL803JZS._AC_SL1500_.jpg","https://m.media-amazon.com/images/W/MEDIAX_792452-T2/images/I/71ge8REhELS._AC_SL1500_.jpg","https://m.media-amazon.com/images/W/MEDIAX_792452-T2/images/I/71h96wrv4JS._AC_SL1500_.jpg",,,,,,,"true","In Stock  Only 4 left in stock - order soon.","false",,,,"CA","Canada","","","","","","","","","Needle Nose Pliers","Needle nose pliers get into hard-to-reach areas for cutting, bending, twisting and gripping wire.","Bubble Level, Magnetic Spirit Level","Material: ABS+solvent oil Measuring Method: horizontal/vertical/45°","Digital Voltage Tester Pen","The default AC voltage measurement range is 12 - 220V, it meets the need for selecting the most suitable sensitivity before testing on different occasions.",,,,,,"$","69.99","Brand","DD dedeo","Voltage","16.8 Volts","Battery Cell Composition","Lithium Ion","Number of Batteries","2 AAA batteries required.","Amperage","250 Milliamps",,,,,,,,,,,,"3742","/Dedeo-Cordless-Household-Wrenches-Accessories/product-reviews/B08185FNDZ/ref=cm_cr_dp_d_show_all_btm?ie=UTF8&reviewerType=all_reviews","Save 10% with coupon",,,,,,,,,"A3BX9TO6RK7QVL","DD dedeo",,,"/gp/help/seller/at-a-glance.html/ref=dp_merchant_link?ie=UTF8&seller=A3BX9TO6RK7QVL&asin=B08185FNDZ&ref_=dp_merchant_link&isAmazonFulfilled=1",,"$","16.45","4.4","0.04","0.03","0.08","0.14","0.71",,"https://m.media-amazon.com/images/W/MEDIAX_792452-T2/images/I/71zM91ivsbL.__AC_SX300_SY300_QL70_FMwebp_.jpg","DD dedeo Tool Set with Drill, 108Pcs Cordless Drill Household Power Tools Set with 16.8V Lithium Driver Claw Hammer Wrenches Pliers DIY Accessories Tool Kit","https://www.amazon.com/s?k=tools&crid=RA8JEXW4BXDE&sprefix=tool%2Caps%2C318&ref=nb_sb_noss_1&language=en&fs=true&page=2","https://www.amazon.com/dp/B08185FNDZ","B08185FNDZ","B0914TJVFX",,,,,,,,"Size","Tool Set with Drill Red 16.8V",,,"B0914TJVFX","https://m.media-amazon.com/images/W/MEDIAX_792452-T2/images/I/71vggk6xrJL._AC_SL1500_.jpg","https://m.media-amazon.com/images/W/MEDIAX_792452-T2/images/I/819+JOD9GrS._AC_SL1500_.jpg","https://m.media-amazon.com/images/W/MEDIAX_792452-T2/images/I/71Eov3-fj-S._AC_SL1500_.jpg","https://m.media-amazon.com/images/W/MEDIAX_792452-T2/images/I/61tr6Grt1JS._AC_SL1500_.jpg","https://m.media-amazon.com/images/W/MEDIAX_792452-T2/images/I/51rU+xpG52S._AC_.jpg","https://m.media-amazon.com/images/W/MEDIAX_792452-T2/images/I/71EqsAaFg7S._AC_SL1500_.jpg","https://m.media-amazon.com/images/W/MEDIAX_792452-T2/images/I/814iW2JHDnS._AC_SL1500_.jpg",,,,,,,"Tool Set with Drill Red 21V",,,,"https://m.media-amazon.com/images/W/MEDIAX_792452-T2/images/I/51uEfsslSKL._AC_US.jpg","B08185FNDZ","https://m.media-amazon.com/images/W/MEDIAX_792452-T2/images/I/71zM91ivsbL._AC_SL1500_.jpg","https://m.media-amazon.com/images/W/MEDIAX_792452-T2/images/I/81NIbw0bNpS._AC_SL1500_.jpg","https://m.media-amazon.com/images/W/MEDIAX_792452-T2/images/I/71CDdxl+zAL._AC_SL1500_.jpg","https://m.media-amazon.com/images/W/MEDIAX_792452-T2/images/I/812XruENmVS._AC_SL1500_.jpg","https://m.media-amazon.com/images/W/MEDIAX_792452-T2/images/I/71gyL803JZS._AC_SL1500_.jpg","https://m.media-amazon.com/images/W/MEDIAX_792452-T2/images/I/71ge8REhELS._AC_SL1500_.jpg","https://m.media-amazon.com/images/W/MEDIAX_792452-T2/images/I/71h96wrv4JS._AC_SL1500_.jpg",,,,,"Tool Set with Drill Red 16.8V",,,,"https://m.media-amazon.com/images/W/MEDIAX_792452-T2/images/I/513wzLstniL._AC_US.jpg",,,,,,,,,,,,,,,,,,,,,,,,,,,,,,,,,,,,,,,,,,,,,,,,,,,,,,,,,,,,,,,,,,,,,,,,,,,,,,,,,,,,,,,,,,,,,,,,,,,,,,,,,,,,,,,,,,,,,,,,,,,,,,,,,,,,,,,,,,,,,,,,,,,,,,,
,,"B08SJCGTPM",,,,,,,,,,,,,,,,,,,,,,,,,,,,,,,,,,,,,,,,,,,,,,,,,,,,,,,,,,,,,,,,,,,,,,,,,,,,"jar-owl","Tools & Home Improvement › Power & Hand Tools › Power Tools › Drills › Drill Drivers","https://www.amazon.com/s?k=tools&crid=RA8JEXW4BXDE&sprefix=tool%2Caps%2C318&ref=nb_sb_noss_1&language=en&fs=true","63","Thursday, December 28",,,"🔨【16.8V Power Cordless Drill with LED】The 18+1 speed adjustable 16.8V cordless home drill can drill into wood,metal,plastic,etc. Max drilling capacity is 22mm(7/8"""") for wood, 10mm(3/8"""") for steel. 2-Gear-option with max torque 247 in-lbs for high (0-1300rpm) or low (0-350rpm) speed drilling/driving speeds. The forward and reserse variable speed trigger is easy to control drilling speeds and reverse out drill bits, a lock-on button and the LED lights on the drill provides for ease of drill.","🔨【Two Replaceable Batteries, Fast Charger】The cordless drill has two replaceable batteries for easy operation. Powered by 1.3 rechargeable battery and charger.The charger runs at standard US 110/120 volt. This battery provides power for upto 8Nm of forward.","🔨【Ergonomic Design, Easy to Use】Cordless tools are manufactured from steel alloy, chrome plated to resist corrosion, with non-slip comfort grip handles for longer life. Lightweight, Durability, Sturdiness, Safe and Compact tools fits into tight areas perfectly. Ergonomic comfort grip handle provides ideal balance and tool control for fastening tasks. Tools are neatly stored in a sturdy case that keeps them secure, clean, organised and easy to find.","🔨【Multi-functional Cordless Drill Driver Tool Kit】This professional home power tool drill set contains the most useful advanced tools for designing, repairing or maintaining. Whether it is decoration, Furniture assembly, drilling, cutting, garden, office or daily home repairs maintenance.this compact tool kit has you covered with the right tools.","🔨【jar_owl Home Tool Kit with 1 Year Warranty】The tool kit set with drill has more than 60 pieces home repair tool set. claw hammer, saw, vise, wrench, phillips screwdriver, slotted screwdriver, precision screwdriver, needle nose pliers,tape measure,electric pen,spirit level,box cutter,blade,electric tape,driver bits,impact drill,twist drill,bit extension,sleeve,screw extension tube,screw. Heavy duty cordless drill combo kit that you can rely on. ❤1 Year Warranty❤",,,,,,"https://m.media-amazon.com/images/I/51JJd35nSpL._AC_US.jpg","https://m.media-amazon.com/images/I/511L48cpM8L._AC_US.jpg","https://m.media-amazon.com/images/I/51hYajreLeL._AC_US.jpg","https://m.media-amazon.com/images/I/51Ot9hxXYYL._AC_US.jpg","https://m.media-amazon.com/images/I/51COyR8ZIdS._AC_US.jpg","https://m.media-amazon.com/images/I/51qiUfjvxGL._AC_US.jpg","https://m.media-amazon.com/images/I/91T5vUsSCtL.SS125_PKplay-button-mb-image-grid-small_.jpg","true","https://m.media-amazon.com/images/I/81RHedrX3ML._AC_SL1500_.jpg","https://m.media-amazon.com/images/I/71BSwaXIRaL._AC_SL1500_.jpg","https://m.media-amazon.com/images/I/71C4JTj2oML._AC_SL1500_.jpg","https://m.media-amazon.com/images/I/71ErF17izgL._AC_SL1500_.jpg","https://m.media-amazon.com/images/I/81QK5hhrLLS._AC_SL1500_.jpg","https://m.media-amazon.com/images/I/71ph2N4-PjL._AC_SL1500_.jpg",,,,,,,,"true","In Stock","false",,,,"US","Update location",,,,,,,,,,,,,,,,,,,,"$","69.98","Brand","jar-owl","Voltage","16.8 Volts","Battery Cell Composition","Lithium Ion","Item Torque","350 Inch Pounds","Amperage","1.3 Amps",,,,,,,,,,,,"1734","/Cordless-Drill-Household-Garden-Maintain-Black/product-reviews/B08SJCGTPM?reviewerType=all_reviews","Save 5% with coupon",,,,,,,,,"A2M8PKZYKAMY7L","Tool Home Store",,,"/gp/help/seller/at-a-glance.html/ref=dp_merchant_link?ie=UTF8&seller=A2M8PKZYKAMY7L&asin=B08SJCGTPM&ref_=dp_merchant_link&isAmazonFulfilled=1",,,,"4.4","0.04","0.03","0.08","0.16","0.69",,"https://m.media-amazon.com/images/I/81RHedrX3ML.__AC_SX300_SY300_QL70_FMwebp_.jpg","108 Piece Power Tool Combo Kits with 16.8V Cordless Drill, Household Tools Set with DIY Hand Tool Kits for Professional Garden Office Home Repair Maintain-Black/Red","https://www.amazon.com/s?k=tools&crid=RA8JEXW4BXDE&sprefix=tool%2Caps%2C318&ref=nb_sb_noss_1&language=en&fs=true&page=2","https://www.amazon.com/dp/B08SJCGTPM","B08SJCGTPM","B08SHQR3G3",,,,,,,,"Style","Red Drill Tool Set with Charger&Battery",,,"B08SHQR3G3","https://m.media-amazon.com/images/I/71X24K9AfoL._AC_SL1500_.jpg","https://m.media-amazon.com/images/I/71zqRN0mYSL._AC_SL1500_.jpg","https://m.media-amazon.com/images/I/71DKQERUhGL._AC_SL1500_.jpg","https://m.media-amazon.com/images/I/81zIx9Y+31L._AC_SL1500_.jpg","https://m.media-amazon.com/images/I/71gfxJ-5vSL._AC_SL1500_.jpg","https://m.media-amazon.com/images/I/71OPpRltSmL._AC_SL1500_.jpg","https://m.media-amazon.com/images/I/71-QLvjMmGL._AC_SL1500_.jpg",,,,,,,"Blue Drill Tool Kit with Charger&Battery",,,,"https://m.media-amazon.com/images/I/51fMEb8Z9WL._AC_US.jpg","B08SJCGTPM","https://m.media-amazon.com/images/I/81RHedrX3ML._AC_SL1500_.jpg","https://m.media-amazon.com/images/I/71BSwaXIRaL._AC_SL1500_.jpg","https://m.media-amazon.com/images/I/71C4JTj2oML._AC_SL1500_.jpg","https://m.media-amazon.com/images/I/71ErF17izgL._AC_SL1500_.jpg","https://m.media-amazon.com/images/I/81QK5hhrLLS._AC_SL1500_.jpg","https://m.media-amazon.com/images/I/71ph2N4-PjL._AC_SL1500_.jpg",,,,,,"Red Drill Tool Set with Charger&Battery",,,,"https://m.media-amazon.com/images/I/51JJd35nSpL._AC_US.jpg",,,,,,,,,,,,,,,,,,,,,,,,,,,,,,,,,,,,,,,,,,,,,,,,,,,,,,,,,,,,,,,,,,,,,,,,,,,,,,,,,,,,,,,,,,,,,,,,,,,,,,,,,,,,,,,,,,,,,,,,,,,,,,,,,,,,,,,,,,,,,,,,,,,,,,,
,"72","B076MGPQZQ",,,,,,,,,,,,,,,,,,,,,,,,,,,,,,,,,,,,,,,,,,,,,,,,,,,,,,,,,,,,,,,,,,,,,,,,,,,,"Klein Tools","Tools & Home Improvement › Power & Hand Tools › Hand Tools › Crimpers","https://www.amazon.com/s?k=tools&crid=RA8JEXW4BXDE&sprefix=tool%2Caps%2C318&ref=nb_sb_noss_1&language=en&fs=true","77","December 31 - January 3",,"December 28 - 30","Modular crimp-connector installation tool for voice and data applications with Pass-Thru RJ45 connector plugs","Wire stripper, crimper, and cutter all-in-one tool for STP/UTP paired-conductor data cables","Trims flush to end face of connector eliminating unintended contact between conductors","Crimps and trims Klein Tools RJ45 Pass-Thru Connectors","Crimps 4, 6 and 8 position modular connectors (RJ11/RJ12 standard and RJ45 Klein Tools Pass-Thru)","Full-cycle ratchet mechanism ensures complete connector termination","On-tool wiring guide helps minimize wiring errors",,,,"https://m.media-amazon.com/images/W/MEDIAX_792452-T2/images/I/41BFlE4BuSL._SX38_SY50_CR,0,0,38.jpg","https://m.media-amazon.com/images/W/MEDIAX_792452-T2/images/I/51Z8sqlCP0L._SX38_SY50_CR,0,0,38.jpg","https://m.media-amazon.com/images/W/MEDIAX_792452-T2/images/I/51gUOMa72YL._SX38_SY50_CR,0,0,38.jpg","https://m.media-amazon.com/images/W/MEDIAX_792452-T2/images/I/41NBYVC59gL._SX38_SY50_CR,0,0,38.jpg","https://m.media-amazon.com/images/W/MEDIAX_792452-T2/images/I/41jt1HxSklL._SX38_SY50_CR,0,0,38.jpg","https://m.media-amazon.com/images/W/MEDIAX_792452-T2/images/I/41fA7-AbOuL._SX38_SY50_CR,0,0,38.jpg",,"true","https://m.media-amazon.com/images/W/MEDIAX_792452-T2/images/I/51QMPNGizfL._SL1000_.jpg","https://m.media-amazon.com/images/W/MEDIAX_792452-T2/images/I/61n9Jh4rjtL._SL1000_.jpg","https://m.media-amazon.com/images/W/MEDIAX_792452-T2/images/I/6152bCzpuQL._SL1000_.jpg","https://m.media-amazon.com/images/W/MEDIAX_792452-T2/images/I/61DGV91SduL._SL1000_.jpg","https://m.media-amazon.com/images/W/MEDIAX_792452-T2/images/I/61kbqTDeoPL._SL1000_.jpg","https://m.media-amazon.com/images/W/MEDIAX_792452-T2/images/I/615sydCZ-7L._SL1000_.jpg","https://m.media-amazon.com/images/W/MEDIAX_792452-T2/images/I/51NvmlIk28L._SL1000_.jpg","https://m.media-amazon.com/images/W/MEDIAX_792452-T2/images/I/51jGuxuZ1jL._SL1000_.jpg","https://m.media-amazon.com/images/W/MEDIAX_792452-T2/images/I/51mnINUQV8L._SL1000_.jpg","https://m.media-amazon.com/images/W/MEDIAX_792452-T2/images/I/510kKiyzkhL._SL1000_.jpg","https://m.media-amazon.com/images/W/MEDIAX_792452-T2/images/I/51Bm4WgYKDL._SL1000_.jpg","https://m.media-amazon.com/images/W/MEDIAX_792452-T2/images/I/716jwy1pRcL._SL1500_.jpg",,"true","In Stock  In Stock","false",,,,"US","Update location",,,,,,,,,,,,,,,,,,,,"$","49.97","Brand","Klein Tools","Color","Yellow/Black","Item Weight","14.4 Ounces","Product Dimensions","6.1""L x 1.11""W","Handle Material","comfort grip",,,,,,,,,,,,"10166","/Pass-Thru-Reliable-Klein-Tools-VDV226-110/product-reviews/B076MGPQZQ?reviewerType=all_reviews",,,"410 Terry Ave N","Seattle","WA","98109","US",,"Amazon.com, Inc.",,"Amazon.com","1-206-266-1000",,"https://www.amazon.com",,,,"4.8","0.01","0.01","0.02","0.09","0.86",,"https://m.media-amazon.com/images/W/MEDIAX_792452-T2/images/I/41BFlE4BuSL._SY445_SX342_QL70_FMwebp_.jpg","Klein Tools VDV226-110 Ratcheting Modular Data Cable Crimper / Wire Stripper / Wire Cutter for RJ11/RJ12 Standard, RJ45 Pass-Thru Connectors","https://www.amazon.com/s?k=tools&crid=RA8JEXW4BXDE&sprefix=tool%2Caps%2C318&ref=nb_sb_noss_1&language=en&fs=true&page=2","https://www.amazon.com/dp/B076MGPQZQ","B076MGPQZQ","B08DY55SLM",,,,,,,,"Style","Crimper",,,"B076MGPQZQ","https://m.media-amazon.com/images/W/MEDIAX_792452-T2/images/I/51QMPNGizfL._SL1000_.jpg","https://m.media-amazon.com/images/W/MEDIAX_792452-T2/images/I/61n9Jh4rjtL._SL1000_.jpg","https://m.media-amazon.com/images/W/MEDIAX_792452-T2/images/I/6152bCzpuQL._SL1000_.jpg","https://m.media-amazon.com/images/W/MEDIAX_792452-T2/images/I/61DGV91SduL._SL1000_.jpg","https://m.media-amazon.com/images/W/MEDIAX_792452-T2/images/I/61kbqTDeoPL._SL1000_.jpg","https://m.media-amazon.com/images/W/MEDIAX_792452-T2/images/I/615sydCZ-7L._SL1000_.jpg","https://m.media-amazon.com/images/W/MEDIAX_792452-T2/images/I/51NvmlIk28L._SL1000_.jpg","https://m.media-amazon.com/images/W/MEDIAX_792452-T2/images/I/51jGuxuZ1jL._SL1000_.jpg","https://m.media-amazon.com/images/W/MEDIAX_792452-T2/images/I/51mnINUQV8L._SL1000_.jpg","https://m.media-amazon.com/images/W/MEDIAX_792452-T2/images/I/510kKiyzkhL._SL1000_.jpg","https://m.media-amazon.com/images/W/MEDIAX_792452-T2/images/I/51Bm4WgYKDL._SL1000_.jpg","https://m.media-amazon.com/images/W/MEDIAX_792452-T2/images/I/716jwy1pRcL._SL1500_.jpg",,"Crimper",,"$","49.97","https://m.media-amazon.com/images/W/MEDIAX_792452-T2/images/I/41BFlE4BuSL._SX38_SY50_CR,0,0,38.jpg","B08DY55SLM","https://m.media-amazon.com/images/W/MEDIAX_792452-T2/images/I/41ObbEj2zdL._SL1001_.jpg","https://m.media-amazon.com/images/W/MEDIAX_792452-T2/images/I/51-yXgBHyCL._SL1000_.jpg","https://m.media-amazon.com/images/W/MEDIAX_792452-T2/images/I/61s32pnGZSL._SL1000_.jpg","https://m.media-amazon.com/images/W/MEDIAX_792452-T2/images/I/713FisSUp-S._SL1000_.jpg",,,,,,,,"Crimper & Plugs",,"$","78.38","https://m.media-amazon.com/images/W/MEDIAX_792452-T2/images/I/31WdXcb29ML._SX38_SY50_CR,0,0,38.jpg",,,,,,,,,,,,,,,,,,,,,,,,,,,,,,,,,,,,,,,,,,,,,,,,,,,,,,,,,,,,,,,,,,,,,,,,,,,,,,,,,,,,,,,,,,,,,,,,,,,,,,,,,,,,,,,,,,,,,,,,,,,,,,,,,,,,,,,,,,,,,,,,,,,,,,,
,,"B09SKFVSMZ","Brand","","Voltage","","Power Source","","Color","","Special Feature","","Included Components","","Item Weight","","Maximum Rotational Speed","","Number of Batteries","","Style","","Item Dimensions LxWxH","","Minimum Speed","","Manufacturer","","Part Number","","Item Weight","","Product Dimensions","","Country of Origin","","Item model number","","Batteries","","Size","","Material","","Item Package Quantity","","Special Features","","Batteries Included?","","Batteries Required?","","Battery Cell Type","","Warranty Description","","ASIN","B09SKFVSMZ","Date First Available","May 23, 2022",,,,,"Tools & Home Improvement","3088","https://www.amazon.com/gp/bestsellers/hi/ref=pd_zg_ts_hi","Power Rotary Tools","10","https://www.amazon.com/gp/bestsellers/hi/552862/ref=pd_zg_hrsr_hi",,,,,,,,"Dremel","Tools & Home Improvement › Power & Hand Tools › Power Tools › Rotary Tools","https://www.amazon.com/s?k=tools&crid=RA8JEXW4BXDE&sprefix=tool%2Caps%2C318&ref=nb_sb_noss_1&language=en&fs=true","78","Thursday, December 28","The Dremel 8240 offers high performance and versatility, packaged in a sleek new tool design. As the new flagship 12-volt cordless rotary tool, the 8240 features an optimized battery platform allowing DIYers to comfortably tackle a wide range of home improvement projects without the distraction of a cord. The powerful 12-Volt / 2 AH Lithium-Ion battery provides maximum performance for extended working sessions. The new 8240 provides cord-like power in cordless form giving you the confidence to tackle the toughest of jobs.",,"Compact, Portable & Powerful: 12 Volt / 2 AH Lithium-Ion battery provides maximum performance, high power, and runtime at all speeds (5,000-35,000 RPM).","Innovative Tool Design: Sleek & ergonomic design with 360-degree grip zone maximizes comfort and control allowing continuous performance for extended working sessions.","Versatile: Able to perform the widest range of applications, including but not limited to cutting, sanding & grinding / sharpening. Fully compatible with all Dremel Accessories & Attachments.","Quick Accessory Changes: Patented EZ Twist Nose Cap makes accessory changes fast and easy without the need of a wrench","Advanced technology for optimum battery life, runtime and power","LED battery life indicators indicates remaining battery life before a recharge is needed","Ventilation openings for smooth, cool and quiet operation",,,,"https://m.media-amazon.com/images/I/41Yl8CfczXL._AC_US.jpg","https://m.media-amazon.com/images/I/41NvCLA1hJL._AC_US.jpg","https://m.media-amazon.com/images/I/41x5ezBuq-L._AC_US.jpg","https://m.media-amazon.com/images/I/51IsQvdHNBL._AC_US.jpg","https://m.media-amazon.com/images/I/61Fwz1lFBHL._AC_US.jpg","https://m.media-amazon.com/images/I/51cTo9m3tpL._AC_US.jpg","https://m.media-amazon.com/images/I/51m2WisW5bL.SS125_PKplay-button-mb-image-grid-small_.jpg","true","https://m.media-amazon.com/images/I/81Tm3UQDN5L._AC_SL1500_.jpg","https://m.media-amazon.com/images/I/818Hx6vDcoL._AC_SL1500_.jpg","https://m.media-amazon.com/images/I/810Idta5ewL._AC_SL1500_.jpg","https://m.media-amazon.com/images/I/91WHbOILe5L._AC_SL1500_.jpg","https://m.media-amazon.com/images/I/A1townAhOhL._AC_SL1500_.jpg","https://m.media-amazon.com/images/I/81rnHCzzhQL._AC_SL1500_.jpg","https://m.media-amazon.com/images/I/91L7r1SmUcL._AC_SL1500_.jpg","https://m.media-amazon.com/images/I/71LKTf2XCbL._AC_SL1500_.jpg",,,,,,"true","In Stock","false",,,,"CA","Canada",,,,,,,,,,,,,,,,,,,,"$","99","Brand","Dremel","Voltage","12 Volts","Power Source","Battery Powered","Color","Black","Special Feature","Cordless",,,,,,,,,,,,"817","/Dremel-Cordless-Rotary-Variable-Comfort/product-reviews/B09SKFVSMZ/ref=cm_cr_dp_d_show_all_btm?ie=UTF8&reviewerType=all_reviews",,,"410 Terry Ave N","Seattle","WA","98109","US",,"Amazon.com, Inc.",,"Amazon.com","1-206-266-1000",,"https://www.amazon.com",,"$","11.64","4.7","0.02","0.01","0.03","0.14","0.8",,"https://m.media-amazon.com/images/I/81Tm3UQDN5L.__AC_SX300_SY300_QL70_FMwebp_.jpg","Dremel 8240 12V Cordless Rotary Tool Kit with Variable Speed and Comfort Grip - Includes 2AH Battery Pack, Charger, 5 Accessories & Wrench, Tool Fabric Carry Bag, and Instruction Manual","https://www.amazon.com/s?k=tools&crid=RA8JEXW4BXDE&sprefix=tool%2Caps%2C318&ref=nb_sb_noss_1&language=en&fs=true&page=2","https://www.amazon.com/dp/B09SKFVSMZ","B09SKFVSMZ","B0C1HR8N9N","B0BZX3RVPF","B0C1HSKHZV",,,,,,"Style","Tool Kit",,,"B0BZX3RVPF","https://m.media-amazon.com/images/I/51nIGXm5TPL._AC_SL1001_.jpg",,,,,,,,,,,,,"Tool Kit + Extra Battery",,"$","142.75","https://m.media-amazon.com/images/I/31HPvgYkfoL._AC_US.jpg","B0C1HSKHZV","https://m.media-amazon.com/images/I/41a2ilKvGpL._AC_SL1001_.jpg",,,,,,,,,,,"Tool Kit + Flex Shaft",,"$","125.99","https://m.media-amazon.com/images/I/31DmmtvohyL._AC_US.jpg","B0C1HR8N9N","https://m.media-amazon.com/images/I/51Vep9dyCxL._AC_SL1001_.jpg",,,,,,,,,,,,,,,,,,,,"Tool Kit + Cutting Discs",,"$","115.99","https://m.media-amazon.com/images/I/316skH7kGKL._AC_US.jpg","B09SKFVSMZ","https://m.media-amazon.com/images/I/81Tm3UQDN5L._AC_SL1500_.jpg","https://m.media-amazon.com/images/I/818Hx6vDcoL._AC_SL1500_.jpg","https://m.media-amazon.com/images/I/810Idta5ewL._AC_SL1500_.jpg","https://m.media-amazon.com/images/I/91WHbOILe5L._AC_SL1500_.jpg","https://m.media-amazon.com/images/I/A1townAhOhL._AC_SL1500_.jpg","https://m.media-amazon.com/images/I/81rnHCzzhQL._AC_SL1500_.jpg","https://m.media-amazon.com/images/I/91L7r1SmUcL._AC_SL1500_.jpg","https://m.media-amazon.com/images/I/71LKTf2XCbL._AC_SL1500_.jpg",,,"Tool Kit",,"$","99","https://m.media-amazon.com/images/I/41Yl8CfczXL._AC_US.jpg",,,,,,,,,,,,,,,,,,,,,,,,,,,,,,,,,,,,,,,,,,,,,,,,,,,,,,,,,,,,,,,,,,,,,,,,,,,,,,,,,,,,,,,,,,,,,,,,,,,,,,,,,,,,,
